,comment,bias
390,We need leaders who support free enterprise and economic freedom.,right
391,The current political climate is too focused on redistributing wealth.,right
392,"The government should focus on protecting citizens, not controlling them.",right
393,We need to return to the principles of limited government.,right
394,The current administration is overstepping its authority.,right
395,Common-sense gun control measures are necessary to reduce gun violence and protect our communities.,left
396,We should increase taxes on the wealthy to ensure everyone pays their fair share and fund essential public services.,left
397,Comprehensive immigration reform is needed to provide a path to citizenship for undocumented immigrants and protect their rights.,left
398,Social media companies should be held accountable for spreading misinformation and hate speech.,left
399,Investing in green energy and addressing climate change is crucial for our future and the health of our planet.,left
400,"Healthcare is a human right, and we should expand access to quality, affordable healthcare for everyone.",left
401,"Public education needs more funding to ensure all children, regardless of their background, have access to quality education.",left
402,"Media diversity is important to ensure a variety of perspectives are represented, and we should support independent journalism.",left
403,Welfare programs are necessary to provide a safety net for the most vulnerable members of society.,left
404,"Religious freedom is important, but it should not be used to discriminate against others.",left
405,Reducing the national debt should not come at the expense of vital social programs that support the well-being of citizens.,left
406,Affirmative action helps address historical inequalities and provides opportunities for marginalized groups.,left
407,Police reform is needed to address systemic racism and ensure accountability for misconduct.,left
408,"Education should be inclusive and teach children about diversity, tolerance, and social justice.",left
409,The United States should rejoin the Paris Agreement and take a leading role in combating climate change.,left
410,"Judicial decisions should protect civil rights and liberties, not undermine them.",left
411,Social safety nets are essential for economic stability and helping individuals in times of need.,left
412,Big tech companies need more regulation to protect consumer privacy and prevent monopolistic practices.,left
413,We should make voting easier and more accessible to ensure that every citizen can participate in the democratic process.,left
414,Federal government intervention is necessary to address systemic inequality and provide public goods.,left
415,"Immigration enriches our culture and economy, and we should welcome immigrants with open arms.",left
416,Gun control laws are necessary to reduce the number of mass shootings and save lives.,left
417,Climate change is a real and urgent threat. We need aggressive policies to reduce carbon emissions.,left
418,Holding people accountable for their harmful actions is not cancel culture; it's a step toward justice.,left
419,"Family planning services and reproductive rights should be accessible to all, without restrictions.",left
420,Social programs like universal healthcare and free college tuition can improve quality of life for everyone.,left
421,"Criminal justice reform should focus on rehabilitation and restorative justice, not just punishment.",left
422,"Military spending should be reduced, and funds should be redirected to education, healthcare, and infrastructure.",left
423,The popular vote should determine presidential elections to reflect the true will of the people.,left
424,Separation of church and state is essential to protect freedom of religion and maintain a secular government.,left
425,Supporting small businesses through grants and low-interest loans is crucial for economic growth and job creation.,left
426,Welfare programs should be strengthened to ensure no one falls through the cracks in times of economic hardship.,left
427,"Free speech is important, but it should not be used to justify hate speech or incitement to violence.",left
428,Education reform should prioritize closing the achievement gap and providing equal opportunities for all students.,left
429,Government intervention in the economy is necessary to address market failures and promote social welfare.,left
430,We should invest in renewable energy sources like wind and solar to reduce our dependence on fossil fuels.,left
431,Comprehensive immigration reform should include protections for DACA recipients and their families.,left
432,Economic policies should focus on reducing income inequality and providing living wages for all workers.,left
433,Strong labor unions are essential for protecting workers' rights and ensuring fair wages and benefits.,left
434,The Constitution should be interpreted as a living document that evolves with society's changing values.,left
435,Law enforcement reforms are necessary to rebuild trust between police and the communities they serve.,left
436,"Gun control measures, such as background checks and assault weapon bans, are necessary to save lives.",left
437,"Every child has the right to a quality education, regardless of their zip code or socioeconomic status.",left
438,The U.S. should lead the global fight against climate change by setting ambitious targets for carbon reduction.,left
439,Marriage equality is a fundamental right that should be protected and celebrated.,left
440,"Public healthcare options, like Medicare for All, would ensure that no one goes bankrupt due to medical expenses.",left
441,Investing in public transportation is essential for reducing traffic congestion and lowering carbon emissions.,left
442,Diversity in the judiciary is important to reflect the experiences and perspectives of all Americans.,left
443,Social media platforms should do more to combat online harassment and misinformation.,left
444,We need to invest in affordable housing initiatives to address homelessness and provide stable living conditions.,left
445,Education should include comprehensive sex education to equip young people with knowledge about health and relationships.,left
446,The government should invest in science and technology research to drive innovation and address societal challenges.,left
447,We need stronger consumer protection laws to prevent predatory lending and financial exploitation.,left
448,Affordable childcare is essential for working parents and should be a priority for public policy.,left
449,Healthcare access should not be determined by one's employment status; everyone deserves coverage.,left
450,We should support public arts and culture programs that enrich communities and promote social cohesion.,left
451,Paid family leave should be a right for all workers to ensure they can care for their families without financial hardship.,left
452,"Voting rights must be protected, and any form of voter suppression should be condemned and prevented.",left
453,"Equal pay for equal work should be a standard practice, regardless of gender, race, or sexual orientation.",left
454,"Higher education should be accessible to all, and student loan debt relief is necessary for economic justice.",left
455,Mental health services should be widely available and destigmatized as part of comprehensive healthcare.,left
456,Gun violence prevention requires community-based approaches and sensible regulations.,left
457,Labor rights and protections should be strengthened to ensure safe and fair working conditions for all.,left
458,"The criminal justice system should be focused on rehabilitation, not just punishment, to reduce recidivism.",left
459,We should expand programs that provide nutrition assistance to children and families in need.,left
460,"Addressing income inequality is essential for a just society, and tax reform should reflect this priority.",left
461,Environmental justice is crucial; we must address the disproportionate impact of pollution on marginalized communities.,left
462,Ending mass incarceration and reforming drug laws are necessary steps toward a fairer justice system.,left
463,"Reproductive rights are fundamental, and we should protect access to safe and legal abortion.",left
464,Net neutrality should be maintained to ensure an open and free internet for all users.,left
465,We need to invest in public health infrastructure to better prepare for future pandemics.,left
466,Urban development should prioritize affordable housing and public spaces that benefit the entire community.,left
467,Education funding should prioritize underfunded schools and reduce disparities in resources and outcomes.,left
468,We need to tackle systemic racism by enacting policies that promote equality and justice for all.,left
469,Workers should have the right to unionize and collectively bargain for better wages and working conditions.,left
470,Renewable energy jobs offer a sustainable path forward for the economy and the environment.,left
471,We need comprehensive criminal justice reform that addresses racial disparities and focuses on rehabilitation.,left
472,"Healthcare should be a universal right, not a privilege based on income or employment status.",left
473,Campaign finance reform is necessary to reduce the influence of money in politics and ensure fair elections.,left
474,The government should provide universal pre-K education to give every child a strong start in life.,left
475,Reforming the electoral college will make our democracy more representative of the people's will.,left
476,We should raise the minimum wage to ensure all workers can earn a living wage.,left
477,Police departments should implement de-escalation training and community policing to build trust.,left
478,"Climate justice means addressing both the causes and effects of climate change, especially for vulnerable communities.",left
479,Mental health care should be integrated into primary care settings to provide holistic health services.,left
480,Public funding for the arts should be increased to support cultural expression and creativity.,left
481,"We need to protect LGBTQ+ rights and ensure equality in all aspects of life, including marriage and employment.",left
482,Mass transit systems should be expanded to reduce traffic congestion and pollution in urban areas.,left
483,We should decriminalize drug possession and focus on treatment and harm reduction strategies.,left
484,"Human rights should be a cornerstone of U.S. foreign policy, promoting democracy and freedom globally.",left
485,Affordable healthcare is essential for a productive and prosperous society.,left
486,We should support public broadcasting and media outlets to provide unbiased news and information.,left
487,DACA recipients deserve a pathway to citizenship; their contributions enrich our country.,left
488,Economic policies should prioritize creating jobs that provide living wages and benefits.,left
489,Environmental protection laws should be strengthened to safeguard our natural resources and biodiversity.,left
490,We should expand access to early childhood education to close the achievement gap.,left
491,"Clean water and air are basic human rights, and we must enforce regulations to protect them.",left
492,"Equal rights for women include access to healthcare, reproductive rights, and equal pay.",left
493,The government should invest in infrastructure projects that create jobs and improve public safety.,left
494,We need to address the root causes of poverty with comprehensive social and economic policies.,left
495,"Education should be a right, not a privilege, and we should eliminate barriers to higher learning.",left
496,Comprehensive immigration reform should include protections for asylum seekers and refugees.,left
497,Labor laws should protect gig workers and ensure they have access to benefits and job security.,left
498,"Gender equality is essential for a fair and just society, and we must continue to fight for women's rights.",left
499,"Climate change poses a threat to national security, and we should treat it with the urgency it deserves.",left
500,We should support progressive taxation policies that ask more from those who can afford it.,left
501,Public schools should teach a curriculum that includes diverse perspectives and histories.,left
502,The government should regulate campaign spending to prevent corporate influence over our elections.,left
503,We need to invest in renewable energy technologies to reduce our carbon footprint and create jobs.,left
504,Prison reform should focus on rehabilitation and reducing recidivism through education and job training.,left
505,"Affordable housing is a human right, and we should support policies that make housing accessible for all.",left
506,"Income inequality is a significant issue, and we need policies that promote economic fairness.",left
507,Social services should be expanded to support individuals struggling with mental health and addiction.,left
508,LGBTQ+ rights must be protected to ensure everyone can live free from discrimination and violence.,left
509,We should increase funding for public schools and ensure equitable access to quality education.,left
510,Ending the school-to-prison pipeline requires investment in education and community support programs.,left
511,Climate action should be a national priority to protect our environment and future generations.,left
512,We need a progressive immigration policy that values the contributions of immigrants and respects their rights.,left
513,"Healthcare for all is possible, and it's time we join other developed nations in guaranteeing it.",left
514,Community-based policing can help build trust and reduce crime by involving residents in safety efforts.,left
515,Economic growth should not come at the expense of workers' rights or environmental protection.,left
516,Public universities should be tuition-free to reduce student debt and increase access to higher education.,left
517,Addressing climate change requires bold leadership and a commitment to renewable energy solutions.,left
518,"We should support the development of affordable, accessible public housing to combat homelessness.",left
519,The U.S. should adopt universal healthcare to ensure no one is left without medical care.,left
520,Economic policies should prioritize reducing wealth inequality and supporting the middle class.,left
521,Investing in green jobs can help transition our economy to a sustainable future.,left
522,"Voting rights are fundamental, and we should protect them against any form of suppression.",left
523,We need to dismantle systemic racism and promote equality through policy changes.,left
524,"A just society provides opportunities for all, regardless of race, gender, or socioeconomic background.",left
525,Criminal justice reform should include ending mandatory minimum sentences for non-violent offenses.,left
526,Public transportation improvements can reduce emissions and make cities more livable.,left
527,We should prioritize healthcare access in rural areas to ensure all Americans receive care.,left
528,"Social welfare programs provide essential support and should be strengthened, not cut.",left
529,Supporting union rights is crucial for ensuring fair wages and safe working conditions.,left
530,Environmental protections are necessary to preserve our planet for future generations.,left
531,"Affordable, quality childcare should be accessible to all families to support working parents.",left
532,We need to implement policies that support gender equality in the workplace.,left
533,Government regulations are necessary to protect consumers and ensure fair business practices.,left
534,"Public safety requires a holistic approach, including addressing the root causes of crime.",left
535,Investment in renewable energy can create millions of new jobs and protect the environment.,left
536,"Healthcare should be a right, not a privilege, and we need policies that reflect this belief.",left
537,Reducing the influence of big money in politics will lead to a more democratic society.,left
538,We should support policies that promote economic fairness and reduce wealth inequality.,left
539,"Access to affordable housing is a fundamental right, and we need to address the housing crisis.",left
540,"Public education is the foundation of a strong democracy, and it should be fully funded and supported.",left
541,"Climate change is the greatest threat to our future, and we must act now to mitigate its impact.",left
542,Supporting small businesses through grants and tax breaks helps build strong communities.,left
543,We should adopt a universal basic income to ensure economic security for all citizens.,left
544,"Social justice requires policies that address disparities in wealth, health, and education.",left
545,Reducing carbon emissions is critical to combating climate change and protecting our planet.,left
546,We need to invest in public health initiatives to promote wellness and prevent disease.,left
547,"Access to higher education should be a right, not a privilege, and student debt should be forgiven.",left
548,We should implement progressive tax policies that ensure the wealthy pay their fair share.,left
549,Expanding renewable energy infrastructure is key to achieving a sustainable future.,left
550,"The right to vote is fundamental, and we should make it easier, not harder, for people to participate in elections.",left
551,Social welfare programs are essential for reducing poverty and providing a safety net.,left
552,We need to address income inequality by raising the minimum wage and supporting workers' rights.,left
553,Healthcare should be universal and publicly funded to ensure access for all.,left
554,"Climate action is urgent, and we must transition to renewable energy sources immediately.",left
555,Protecting civil liberties is essential for a free and just society.,left
556,We should support affordable housing initiatives to reduce homelessness and ensure everyone has a safe place to live.,left
557,Public education should be fully funded to provide all children with the opportunities they deserve.,left
558,We need to protect the environment by reducing pollution and promoting sustainable practices.,left
559,Social justice requires addressing systemic inequality and promoting policies that ensure fairness for all.,left
560,"Affordable healthcare is a right, not a privilege, and we need policies that reflect this belief.",left
561,Our nation thrives on the diversity immigrants bring.,left
562,Allowing immigrants into our country strengthens our economy.,left
563,We should welcome refugees with open arms.,left
564,Immigrants contribute significantly to cultural enrichment.,left
565,Providing sanctuary to immigrants aligns with our values.,left
566,Our history is rooted in the contributions of immigrants.,left
567,Denying entry to immigrants goes against human rights.,left
568,Immigration helps fill gaps in the labor market.,left
569,A humane immigration policy is essential.,left
570,Immigrants bring new perspectives that drive innovation.,left
571,Closing borders is not a solution; we need compassion.,left
572,Immigrants are not a burden; they are our strength.,left
573,We need to reform our immigration system to be more inclusive.,left
574,Deporting immigrants is not the answer; integration is.,left
575,Diversity from immigration makes us stronger as a society.,left
576,Immigration laws should prioritize family reunification.,left
577,We need pathways to citizenship for undocumented immigrants.,left
578,Immigration boosts economic growth and prosperity.,left
579,Our nation was built by immigrants; we should honor that.,left
580,Creating a welcoming environment for immigrants benefits everyone.,left
581,We should be focusing on humane treatment of immigrants.,left
582,Immigrants deserve the same opportunities as anyone else.,left
583,Building walls isn't the answer; building bridges is.,left
584,Immigration policy should be based on empathy and justice.,left
585,Immigrants bring essential skills and knowledge.,left
586,A diverse population is key to our nation's success.,left
587,Our immigration policy needs to reflect global compassion.,left
588,Immigrants enrich our cultural and social fabric.,left
589,Denying entry to immigrants ignores our shared humanity.,left
590,We need a fair and just immigration system.,left
591,Supporting immigrants strengthens our national identity.,left
592,Our economy relies on the hard work of immigrants.,left
593,Welcoming immigrants reflects our core values.,left
594,Immigrants are vital to our society's growth and development.,left
595,Immigration policy should prioritize human rights.,left
596,Our future depends on embracing diversity through immigration.,left
597,We should be offering asylum to those fleeing persecution.,left
598,Immigrants contribute to our communities in countless ways.,left
599,A humane immigration approach is morally necessary.,left
600,Everyone deserves a chance at the American dream.,left
601,"Immigration is a solution, not a problem.",left
602,We need to protect the rights of all immigrants.,left
603,Treating immigrants with dignity is non-negotiable.,left
604,The strength of our nation lies in its diversity.,left
605,Immigrants are essential to innovation and creativity.,left
606,Our immigration policies should reflect our compassion.,left
607,We should be expanding opportunities for immigrants.,left
608,Everyone benefits from a more inclusive immigration system.,left
609,Human dignity should guide our immigration policies.,left
610,Immigrants are a fundamental part of our society.,left
611,There should be stricter regulations on who can buy guns.,left
612,The easy access to guns is causing too much violence.,left
613,It's time to rethink the Second Amendment for modern times.,left
614,More guns in circulation mean more deaths and accidents.,left
615,We need universal background checks for all gun sales.,left
616,Guns are the leading cause of death in many mass shootings.,left
617,People don't need military-grade weapons for personal use.,left
618,Banning assault rifles would make our communities safer.,left
619,Gun ownership should be heavily restricted for safety.,left
620,Guns make it too easy for people to act on violent impulses.,left
621,Stricter gun laws could prevent many tragic deaths.,left
622,High-capacity magazines should be illegal.,left
623,Reducing the number of guns would decrease crime rates.,left
624,Children shouldn't have to fear gun violence in schools.,left
625,The gun lobby has too much influence on politics.,left
626,Guns are often involved in domestic violence cases.,left
627,We need more research on the public health impact of guns.,left
628,Gun violence is a public health crisis that needs attention.,left
629,Allowing guns on college campuses is a dangerous idea.,left
630,Stricter gun control laws are necessary to protect our communities.,left
631,Gun buyback programs could help reduce the number of firearms.,left
632,We need to close the gun show loophole immediately.,left
633,The idea that more guns make us safer is a myth.,left
634,Arming teachers is not a solution to school shootings.,left
635,Gun manufacturers should be held accountable for gun violence.,left
636,It's too easy for people with mental illness to access guns.,left
637,Background checks should include mental health evaluations.,left
638,We need to ban bump stocks and other modifications.,left
639,Gun-free zones should be enforced in public spaces.,left
640,Gun violence disproportionately affects marginalized communities.,left
641,Licensing and training should be mandatory for all gun owners.,left
642,The Second Amendment needs to be interpreted in context.,left
643,We should look to other countries with stricter gun laws as models.,left
644,The right to life should take precedence over gun rights.,left
645,Guns are more of a threat than a form of protection.,left
646,"Society needs fewer guns, not more.",left
647,It's time to take serious action on gun control.,left
648,Reducing the number of guns could reduce suicide rates.,left
649,Public safety should come before individual gun ownership.,left
650,Guns are often used to intimidate and threaten others.,left
651,Smart gun technology could reduce accidental shootings.,left
652,The prevalence of guns contributes to a culture of fear.,left
653,No civilian needs a semi-automatic weapon.,left
654,"Gun control is about saving lives, not taking away rights.",left
655,The NRA has blocked common-sense gun reforms for too long.,left
656,The idea of a good guy with a gun stopping crime is flawed.,left
657,Red flag laws are a step in the right direction.,left
658,We should prioritize disarming hate groups.,left
659,Gun violence prevention should be a top priority.,left
660,Every community should have gun violence prevention programs.,left
661,Abortion is a fundamental right that must be protected.,left
662,Women should have the freedom to make choices about their own bodies.,left
663,Access to safe abortion is essential for women's healthcare.,left
664,"Abortion should be legal, safe, and accessible to everyone.",left
665,Restricting abortion access is a violation of human rights.,left
666,Abortion is a private decision that should not be legislated.,left
667,The government should not interfere with a woman's reproductive choices.,left
668,Abortion bans disproportionately affect low-income women.,left
669,"Abortion is healthcare, and healthcare is a right.",left
670,Every woman should have the right to choose what happens to her body.,left
671,Forcing a woman to carry a pregnancy to term is unethical.,left
672,Abortion access is necessary for gender equality.,left
673,Women need access to abortion to have control over their lives.,left
674,Abortion laws should prioritize the health and safety of women.,left
