,comment,bias
82,"Welfare programs should be a safety net, not a way of life. We need to encourage work and self-sufficiency, not dependency on the government.",right
83,Religious freedom is under threat. People should have the right to practice their religion without fear of government interference.,right
84,The national debt is out of control. We need to cut government spending and balance the budget before it's too late.,right
85,"Affirmative action is unfair and outdated. We should be promoting merit-based opportunities for everyone, regardless of race or gender.",right
86,Law and order need to be restored in our cities. We can't let rioters and looters destroy our communities without consequences.,right
87,Parents should have more control over what their kids are being taught in schools. The education system has become too politicized.,right
88,"Energy independence is crucial for national security. We should be expanding domestic energy production, not relying on foreign oil.",right
89,"Judicial activism is a threat to our democracy. Judges should interpret the law, not legislate from the bench.",right
90,The welfare state is unsustainable. We need to reform entitlement programs to ensure they are available for future generations.,right
91,Big tech companies have too much power. They are stifling competition and censoring conservative voices.,right
92,Voter ID laws are common sense. We need to ensure the integrity of our elections by making sure only legal citizens can vote.,right
93,The federal government has become too powerful. We need to return more control to the states and reduce the size of the federal bureaucracy.,right
94,Illegal immigration is a serious problem. We need to enforce our immigration laws and ensure that those who come here do so legally.,right
95,"The Second Amendment is a fundamental right. We should be protecting our right to bear arms, not infringing upon it.",right
96,"Climate change policies should be based on science, not alarmism. We need balanced solutions that protect both the environment and the economy.",right
97,Cancel culture is out of control. People should not be punished for expressing their opinions or making mistakes.,right
98,"The family is the cornerstone of society. We should be supporting strong families, not undermining them with bad policies.",right
99,"Socialism has failed everywhere it's been tried. We should be promoting free markets and individual liberty, not government control.",right
100,Entitlement reform is necessary to save Social Security and Medicare. We need to ensure these programs are sustainable for future generations.,right
101,"Criminal justice reform should focus on reducing crime and supporting victims, not just on reducing sentences for offenders.",right
102,The military needs to be strong and well-funded to protect our nation. We can't afford to weaken our defenses.,right
103,The Electoral College is an important part of our republic. It ensures that all states have a voice in the presidential election.,right
104,Religious liberty must be protected. People should not be forced to act against their beliefs by the government.,right
105,Small businesses are the backbone of the economy. We need to reduce regulations and taxes to help them thrive.,right
106,Welfare reform should encourage work and personal responsibility. We need to help people become self-sufficient.,right
107,"The First Amendment protects all speech, even if it's unpopular. We need to stand up against attempts to silence dissenting opinions.",right
108,"Education reform should focus on improving student outcomes, not on increasing funding for failing schools.",right
109,The free market is the best way to create jobs and grow the economy. Government intervention only creates inefficiencies.,right
110,"We should be focusing on energy independence by expanding domestic oil and gas production, not relying on foreign energy sources.",right
111,Strong borders are essential to national security. We need to enforce our immigration laws and secure our borders.,right
112,"Free enterprise and capitalism have lifted millions out of poverty. We should be promoting these principles, not undermining them.",right
113,Government spending is out of control. We need to cut wasteful spending and balance the budget.,right
114,The Constitution is the foundation of our government. We need to protect it from those who seek to undermine it.,right
115,Law enforcement officers deserve our support. We need to ensure they have the resources they need to keep our communities safe.,right
116,The right to bear arms is essential to protecting our freedoms. We need to stand up against any attempts to infringe on this right.,right
117,Parental rights in education are under threat. Parents should have a say in what their children are being taught in schools.,right
118,America should be a beacon of freedom and democracy. We need to stand up for our values on the global stage.,right
119,Tax cuts stimulate economic growth. We need to keep taxes low to help businesses create jobs and grow the economy.,right
120,Identity politics is divisive and harmful. We should be promoting unity and equality for all Americans.,right
121,"The U.S. military should be focused on winning wars, not on social experiments. We need a strong, effective military to protect our nation.",right
122,Secure elections are the foundation of democracy. We need to implement voter ID laws and ensure transparency in the voting process.,right
123,"Parents know what's best for their children, not bureaucrats. We need more parental involvement and less government interference in education.",right
124,The United States should always put its own citizens first. Policies that favor global interests over American well-being need to be re-evaluated.,right
125,"A strong economy is built on hard work and innovation, not government handouts. We need to encourage entrepreneurship and self-reliance.",right
126,"School curricula should focus on academic excellence, not political indoctrination. Our children deserve a quality education, free from bias.",right
127,The United Nations often undermines American sovereignty. We should be cautious about entangling ourselves in international organizations that do not have our best interests at heart.,right
128,The death penalty should be upheld for the most heinous crimes. It's a just punishment that can deter future criminal activity.,right
129,"Personal responsibility and hard work are the keys to success. We need to foster a culture that rewards these values, not one that promotes victimhood.",right
130,Foreign aid should be carefully scrutinized. We should prioritize funding for domestic programs before sending taxpayer dollars abroad.,right
131,"The federal government should not mandate healthcare. Healthcare decisions should be left to individuals and their doctors, not politicians.",right
132,Public universities should uphold free speech and not become echo chambers for one-sided ideologies. Diverse viewpoints must be encouraged and protected.,right
133,Mandatory minimum sentences are essential for deterring crime. We need strong laws to protect our communities from repeat offenders.,right
134,National security should always be a top priority. We must maintain a strong military and invest in intelligence to protect against threats.,right
135,Term limits are necessary to prevent career politicians from holding power indefinitely. Fresh perspectives are needed in government.,right
136,The Second Amendment isn't just about hunting; it's about the right to protect oneself and resist tyranny. We must protect this fundamental right.,right
137,Climate policy should not sacrifice economic growth. We can balance environmental concerns with the need to keep energy affordable and jobs secure.,right
138,"Free markets, not government mandates, will drive innovation and progress. Overregulation stifles creativity and economic growth.",right
139,"Rural communities are often overlooked. We need to ensure that policies support all Americans, not just those in urban centers.",right
140,"We need a balanced Supreme Court that interprets the Constitution as written, not based on personal beliefs or social trends.",right
141,America should have the strongest military in the world. Peace through strength has been proven to deter conflict and promote stability.,right
142,"We should focus on reducing the influence of special interest groups in politics. Government should serve the people, not lobbyists.",right
143,Civil liberties must be protected in times of crisis. We cannot allow fear to justify the erosion of our constitutional rights.,right
144,Federal agencies need greater accountability and oversight. Bureaucracies should not operate with unchecked power.,right
145,Free speech is a fundamental American value. Efforts to silence or censor dissenting voices are contrary to our democratic principles.,right
146,The welfare system should include work requirements. We need to encourage individuals to become self-sufficient and reduce dependency on government assistance.,right
147,"Judges should be appointed based on their adherence to the Constitution, not their political views. The judiciary must remain impartial and fair.",right
148,"Education funding should follow the student, not the school. School choice empowers parents to choose the best educational path for their children.",right
149,Reducing government regulation will spur economic growth and innovation. We need to cut red tape that holds back businesses and entrepreneurs.,right
150,Religious institutions should not be forced to go against their beliefs. Freedom of religion is a fundamental right that must be protected.,right
151,We need stricter controls on immigration.,right
152,Illegal immigration undermines the rule of law.,right
153,Immigrants should assimilate into our culture.,right
154,We should prioritize the needs of our citizens first.,right
155,Immigration policies should ensure national security.,right
156,Too much immigration puts a strain on public services.,right
157,We need to enforce our borders more strictly.,right
158,Immigrants should come through legal channels only.,right
159,Illegal immigration is a threat to our safety.,right
160,Mass immigration changes the cultural landscape too quickly.,right
161,The government needs to focus on controlling immigration.,right
162,We need to vet immigrants thoroughly for security reasons.,right
163,Illegal immigration hurts job prospects for citizens.,right
164,Our immigration laws need to be enforced without exception.,right
165,We should be selective about who we allow to immigrate.,right
166,High levels of immigration can lead to social tension.,right
167,Our borders need to be secure to protect our way of life.,right
168,Immigration policies should prioritize skilled workers.,right
169,We can't afford to support a large influx of immigrants.,right
170,Illegal immigration is unfair to those who follow the law.,right
171,We need a merit-based immigration system.,right
172,Immigrants should be able to support themselves economically.,right
173,Our immigration policies should be based on national interests.,right
174,Unchecked immigration can lead to increased crime rates.,right
175,We need to know who is entering our country and why.,right
176,Immigration should not compromise national security.,right
177,Illegal immigration puts unnecessary strain on our resources.,right
178,Immigration laws exist for a reason and should be respected.,right
179,We should focus on helping our own citizens first.,right
180,The government should crack down on illegal immigration.,right
181,Immigration reform should include stronger border control.,right
182,Immigration must be controlled to preserve our cultural values.,right
183,We need to put our country’s interests first in immigration policy.,right
184,Allowing too many immigrants can destabilize the economy.,right
185,Our immigration system should be based on merit and need.,right
186,We should prioritize immigrants who can contribute to society.,right
187,Unchecked immigration can lead to overpopulation.,right
188,We need to protect our borders from illegal entry.,right
189,Immigration laws should be strictly enforced to maintain order.,right
190,Illegal immigrants should not receive government benefits.,right
191,Immigration policy should be strict to ensure our safety.,right
192,Mass immigration can lead to cultural clashes.,right
193,We need a strong immigration policy to keep our country safe.,right
194,Illegal immigration is a burden on taxpayers.,right
195,We need to prioritize American jobs in our immigration policies.,right
196,Our immigration system should be efficient but strict.,right
197,Controlling immigration is crucial for our national security.,right
198,Immigration policies should be fair but firm.,right
199,Illegal immigration should be addressed immediately.,right
200,Owning guns is a fundamental right protected by the Constitution.,right
201,People need guns to protect themselves and their families.,right
202,Taking away guns won't stop criminals from getting them.,right
203,Gun ownership is essential for personal freedom and security.,right
204,More guns in the hands of law-abiding citizens mean less crime.,right
205,The Second Amendment is a safeguard against government tyranny.,right
206,Responsible gun ownership is part of American heritage.,right
207,"Banning guns will only disarm law-abiding citizens, not criminals.",right
208,Guns are necessary for self-defense in dangerous situations.,right
209,Training and education can make gun owners more responsible.,right
210,Gun rights are about protecting individual liberty.,right
211,Concealed carry permits should be available in all states.,right
212,Gun-free zones only make people targets for criminals.,right
213,Owning a gun can be a deterrent to potential attackers.,right
214,Every citizen should have the right to defend themselves with a firearm.,right
215,Gun control laws infringe on personal freedoms.,right
216,"Self-defense is a basic human right, and guns make it possible.",right
217,Guns are an important tool for ensuring public safety.,right
218,It's not the guns; it's the people who misuse them.,right
219,Legal gun owners shouldn't be punished for the actions of criminals.,right
220,Guns play a vital role in rural and wilderness survival.,right
221,Gun ownership is a symbol of independence and self-reliance.,right
222,We need more armed citizens to stop mass shootings.,right
223,The right to bear arms is a check against overreach by the state.,right
224,Guns are part of our national identity and history.,right
225,Disarming citizens makes society more vulnerable to criminals.,right
226,Every responsible adult should have the option to own a gun.,right
227,Guns are necessary for protecting property and businesses.,right
228,Gun rights ensure that power remains with the people.,right
229,Arming teachers could prevent school shootings.,right
230,The government should not interfere with private gun ownership.,right
231,More gun control is not the answer to reducing crime.,right
232,Gun ownership is about more than hunting; it's about safety.,right
233,"Guns are the great equalizer, especially for the vulnerable.",right
234,Owning a gun is a form of insurance against threats.,right
235,People who follow the law shouldn't lose their gun rights.,right
236,We need to protect the Second Amendment at all costs.,right
237,Guns are crucial for deterring home invasions.,right
238,A well-armed population is a free population.,right
239,"Background checks are acceptable, but no bans on guns.",right
240,"Self-defense is a fundamental right, and guns ensure that right.",right
241,Banning guns would only empower criminals and tyrants.,right
242,The right to bear arms is as important as the right to free speech.,right
243,"Guns are tools that, like any tool, need responsible handling.",right
244,Gun ownership should be encouraged for personal safety.,right
245,Disarming the populace is the first step towards oppression.,right
246,"We should be focusing on mental health, not gun control.",right
247,"More guns, when used responsibly, can prevent more crimes.",right
248,Abortion is morally wrong and should be restricted.,right
249,"Every life is precious, including the unborn.",right
250,Abortion should be banned except in extreme cases.,right
251,"Life begins at conception, and abortion ends a human life.",right
252,Abortion is the taking of an innocent life.,right
253,"There are alternatives to abortion, like adoption.",right
254,Abortion harms women and ends the life of a child.,right
255,The unborn deserve the same rights as everyone else.,right
256,Abortion is not healthcare; it's the termination of a life.,right
257,Protecting the unborn is a matter of human rights.,right
258,Abortion laws should prioritize the rights of the unborn.,right
259,"We need to protect life at all stages, including before birth.",right
260,"Abortion should be limited to cases of rape, incest, or danger to the mother.",right
261,Defending the rights of the unborn is a moral imperative.,right
262,Abortion is against the values of a society that respects life.,right
263,Unborn children have the right to life and protection.,right
264,Abortion on demand is ethically unacceptable.,right
265,We should focus on supporting women to choose life.,right
266,Abortion is a tragedy that should be avoided whenever possible.,right
267,"The sanctity of life must be upheld, from conception to natural death.",right
268,Abortion should be regulated to protect the unborn.,right
269,"Every child, born or unborn, has a right to life.",right
270,The right to life is fundamental and should extend to the unborn.,right
271,Abortion undermines the value of human life.,right
272,Life should be protected from the moment of conception.,right
273,Abortion is an issue of moral and ethical importance.,right
274,The unborn are the most vulnerable members of our society.,right
275,Abortion laws should reflect the value of all human life.,right
276,Abortion should not be used as a method of birth control.,right
277,"We need to promote a culture of life, not death.",right
278,Abortion is harmful to both the mother and the unborn child.,right
279,Ending a pregnancy is ending a potential future.,right
280,Abortion is a violation of the right to life.,right
281,Unborn children are human beings who deserve protection.,right
282,We should offer support to women facing unplanned pregnancies.,right
283,Abortion denies the most basic right: the right to be born.,right
284,"Life is a gift, and abortion takes that gift away.",right
285,Abortion is a moral wrong that society should not tolerate.,right
286,Protecting the unborn is an obligation of a just society.,right
287,"Abortion should be rare, if allowed at all.",right
288,The unborn should be treated with dignity and respect.,right
289,Abortion laws should be based on the principle of protecting life.,right
290,We need to educate people about the value of life before birth.,right
291,Abortion is an assault on the most defenseless in our society.,right
292,Protecting life is more important than personal convenience.,right
293,Abortion laws should reflect a commitment to life and justice.,right
294,The rights of the unborn should not be ignored.,right
295,We need to stand up for those who cannot speak for themselves.,right
296,Abortion is not a choice; it's the end of a life.,right
297,Taxes are too high and need to be reduced.,right
298,Lowering taxes will stimulate economic growth.,right
299,The government should cut taxes to put more money in people's pockets.,right
300,Taxes are a burden on businesses and families.,right
301,We need tax cuts to encourage job creation.,right
302,High taxes stifle innovation and entrepreneurship.,right
303,"The government should focus on cutting spending, not raising taxes.",right
304,Taxation is a form of government overreach.,right
305,Lower taxes allow individuals to keep more of their hard-earned money.,right
306,Tax cuts have historically led to economic prosperity.,right
307,High corporate taxes drive businesses to move overseas.,right
308,Lowering taxes will increase consumer spending and boost the economy.,right
309,Taxes on capital gains should be reduced to encourage investment.,right
310,The government wastes too much tax money on inefficient programs.,right
311,Cutting taxes will lead to more economic opportunities.,right
312,The wealthy already pay a disproportionate share of taxes.,right
313,"We should focus on cutting taxes, not increasing government programs.",right
314,Taxes should be as low as possible to promote personal freedom.,right
315,Lower taxes will lead to higher government revenue through growth.,right
316,Tax cuts create jobs and improve the economy.,right
317,The best way to stimulate the economy is through tax reduction.,right
318,High taxes punish success and hard work.,right
319,Reducing taxes will increase take-home pay for everyone.,right
320,The government should not take more money from individuals.,right
321,Tax relief should be a priority for middle-class families.,right
322,Flat taxes are a fairer system than progressive taxes.,right
323,Lower corporate taxes will bring businesses back to the country.,right
324,Taxes on businesses should be reduced to boost the economy.,right
325,Cutting taxes is the best way to empower individuals.,right
326,We need to simplify the tax code and lower tax rates.,right
327,High taxes are a barrier to economic growth.,right
328,The government should not tax success and wealth creation.,right
329,Taxes should be limited to essential government functions.,right
330,We should have fewer taxes and more personal responsibility.,right
331,The free market works best with lower tax burdens.,right
332,High taxes lead to government dependency.,right
333,Lowering taxes will increase economic freedom.,right
334,Cutting taxes helps small businesses thrive.,right
335,The government should focus on reducing tax burdens.,right
336,High taxes drive away investment and job creation.,right
337,Reducing taxes will benefit everyone in the long run.,right
338,We need to keep taxes low to maintain a strong economy.,right
339,Tax cuts are the best way to increase personal income.,right
340,The government should prioritize tax cuts over new spending programs.,right
341,Lower taxes increase economic competitiveness.,right
342,Taxes should be kept low to protect individual liberty.,right
343,High taxes discourage people from working harder.,right
344,We should lower taxes to reduce government control over our lives.,right
345,Tax reduction should be a key focus of economic policy.,right
346,The government is overreaching into people's personal lives.,right
347,We need more focus on law and order to ensure safety.,right
348,"Taxes are too high, and government spending is out of control.",right
349,There is too much political correctness in our society today.,right
350,The current administration is too lenient on immigration policies.,right
351,We need to protect our borders and prioritize national security.,right
352,The media is biased and often misrepresents conservative views.,right
353,Free speech is under attack in the current political climate.,right
354,There is too much government regulation stifling business growth.,right
355,Traditional values are being eroded by progressive agendas.,right
356,We need leaders who will stand up for the Constitution.,right
357,The current administration is failing to support small businesses.,right
358,We should focus on reducing government size and interference.,right
359,There is too much government spending on welfare programs.,right
360,We need stronger policies to ensure election integrity.,right
361,The current political climate is hostile to conservative ideas.,right
362,We need to promote self-reliance and personal responsibility.,right
363,The government should not be involved in healthcare decisions.,right
364,The current administration's policies are hurting the economy.,right
365,We need more focus on individual freedom and less on government control.,right
366,The country is moving away from its foundational principles.,right
367,There is too much emphasis on identity politics.,right
368,We need to protect our Second Amendment rights.,right
369,The current political situation is creating division among Americans.,right
370,We should focus on supporting law enforcement and military.,right
371,There is too much emphasis on globalism over national interests.,right
372,The current administration is undermining traditional family values.,right
373,We need stricter voter ID laws to prevent fraud.,right
374,The current political climate is anti-business and anti-capitalism.,right
375,We should prioritize policies that encourage job growth.,right
376,The current administration is not doing enough to combat crime.,right
377,We need to support free market solutions over government intervention.,right
378,The government should not be involved in education; leave it to local control.,right
379,We need to protect our heritage and national identity.,right
380,The current administration is too focused on appeasing foreign countries.,right
381,We should cut taxes to stimulate economic growth.,right
382,The current political landscape is too focused on social issues.,right
383,We need to uphold the rule of law and constitutional rights.,right
384,The country is losing its way with progressive ideologies.,right
385,The current administration's foreign policy is weakening our position globally.,right
386,We need to encourage patriotism and respect for the flag.,right
387,There is too much division caused by identity politics.,right
388,We should prioritize American interests over global interests.,right
389,The government should not dictate what businesses can or can't do.,right
