,comment,bias
675,Abortion should be free of stigma and judgment.,left
676,"Denying abortion access can lead to dangerous, illegal procedures.",left
677,"Abortion is a personal decision, not a political one.",left
678,Reproductive rights are human rights.,left
679,Safe abortion services are a critical part of reproductive health.,left
680,Abortion should be available without restrictions.,left
681,Women deserve autonomy over their reproductive choices.,left
682,Abortion is a matter of personal freedom and bodily autonomy.,left
683,Protecting abortion rights is essential for women's safety.,left
684,Abortion bans are a form of gender discrimination.,left
685,Every person has the right to decide if and when to have children.,left
686,"Restricting abortion access won't stop abortions, just safe ones.",left
687,Abortion care is essential healthcare that should be accessible to all.,left
688,Laws against abortion harm women's health and wellbeing.,left
689,The right to choose is a fundamental aspect of personal liberty.,left
690,Access to abortion is crucial for women's empowerment.,left
691,Abortion restrictions are an attack on women's rights.,left
692,We need to trust women to make their own reproductive decisions.,left
693,Abortion should be treated like any other medical procedure.,left
694,Women should not be criminalized for seeking an abortion.,left
695,Abortion access should be protected from political interference.,left
696,"Safe, legal abortion is a key component of reproductive justice.",left
697,Women should not be forced to carry unwanted pregnancies.,left
698,Abortion rights are critical for a free and just society.,left
699,Abortion care should be part of comprehensive healthcare services.,left
700,Restricting abortion access puts women's lives at risk.,left
701,Abortion bans violate the principle of individual liberty.,left
702,We must protect and expand access to abortion services.,left
703,Abortion is a personal and private healthcare decision.,left
704,"Laws should support, not restrict, reproductive health choices.",left
705,"Every person deserves access to reproductive healthcare, including abortion.",left
706,Abortion is a necessary option for reproductive freedom.,left
707,The right to abortion is essential for gender equity.,left
708,"Abortion should be safe, legal, and free from political interference.",left
709,Denying abortion access is an infringement on personal rights.,left
710,Taxes are necessary to fund public services and welfare programs.,left
711,We need to raise taxes on the wealthy to reduce income inequality.,left
712,"Taxes should be progressive, with higher rates for the rich.",left
713,Increasing taxes on corporations can fund education and healthcare.,left
714,Taxes are a way for the rich to pay their fair share.,left
715,We need higher taxes to invest in infrastructure and green energy.,left
716,Taxes are essential for building a fair and just society.,left
717,Tax revenue should be used to support social safety nets.,left
718,Taxes are the price we pay for a civilized society.,left
719,Taxing the wealthy more is a way to address economic disparities.,left
720,Public schools and healthcare rely on tax funding.,left
721,Progressive taxation helps reduce the wealth gap.,left
722,Higher taxes on luxury goods can help fund public services.,left
723,Taxes should support universal healthcare and free college.,left
724,The government needs more tax revenue to address climate change.,left
725,We need to close tax loopholes used by the rich.,left
726,Taxes are essential for maintaining public infrastructure.,left
727,A wealth tax could help fund social programs.,left
728,Corporate tax breaks should be eliminated to fund social services.,left
729,Taxes should be used to create more affordable housing.,left
730,Higher taxes can help reduce the national debt responsibly.,left
731,The rich should contribute more through increased taxes.,left
732,Taxes on financial transactions could generate significant revenue.,left
733,Tax cuts for the wealthy should be reversed.,left
734,Increased tax revenue can support job training and education.,left
735,Taxes are necessary for funding public health initiatives.,left
736,We should tax capital gains at the same rate as income.,left
737,Taxing carbon emissions can help fight climate change.,left
738,"We need a fair tax system that benefits everyone, not just the rich.",left
739,Higher taxes on billionaires are needed to fund social equality.,left
740,Taxes on inheritances should be increased to prevent wealth hoarding.,left
741,We need to tax corporations that outsource jobs overseas.,left
742,Tax incentives should promote renewable energy investments.,left
743,The wealthy can afford to pay more in taxes for the common good.,left
744,Taxes help provide essential services like police and fire departments.,left
745,A more progressive tax system can fund universal basic income.,left
746,Taxing luxury items can fund social welfare programs.,left
747,We need to ensure that all corporations pay their fair share of taxes.,left
748,Higher taxes on the rich are essential for social justice.,left
749,The government should increase taxes on the top 1% to reduce poverty.,left
750,Taxes are a tool for redistributing wealth more fairly.,left
751,Tax revenue should be used to expand public transportation.,left
752,Taxes on the wealthy should be used to improve public education.,left
753,We need to implement higher taxes to address homelessness.,left
754,Increased taxes on large corporations can fund healthcare reforms.,left
755,Taxes are crucial for maintaining a strong social safety net.,left
756,A higher minimum wage should be supported by tax reforms.,left
757,We should tax companies that avoid paying their fair share.,left
758,Progressive taxes are necessary for a fair economic system.,left
759,Taxes should support programs that reduce economic inequality.,left
760,"The current political climate is too polarized, and we need to come together for progress.",left
761,We need more progressive leaders to address climate change and social justice issues.,left
762,The government should focus more on healthcare and education reform.,left
763,There is too much influence from corporations in politics.,left
764,Income inequality is a pressing issue that needs immediate attention.,left
765,The current political system favors the wealthy and powerful.,left
766,We need to fight for workers' rights and better wages.,left
767,"Social programs are underfunded, and that needs to change.",left
768,The government should be more transparent and accountable to the people.,left
769,There is a lack of action on important issues like climate change.,left
770,Racial and social justice should be a priority in political discussions.,left
771,The influence of money in politics undermines democracy.,left
772,We need more voices advocating for marginalized communities.,left
773,Environmental protection is being ignored by current policies.,left
774,"Healthcare should be a universal right, not a privilege.",left
775,The current political landscape is too focused on divisive issues.,left
776,We need to invest in renewable energy and sustainable practices.,left
777,The rise of nationalism is a threat to global cooperation.,left
778,There is a lack of empathy in current political discourse.,left
779,The government should do more to protect voting rights.,left
780,"Women's rights are under attack, and we need to defend them.",left
781,Public education needs more funding and support.,left
782,There is too much focus on corporate profits over public welfare.,left
783,We need to address systemic racism in our political institutions.,left
784,The current administration is not doing enough to combat climate change.,left
785,Social safety nets need to be strengthened to support vulnerable populations.,left
786,The influence of lobbyists is corrupting the political process.,left
787,We need to prioritize affordable housing and homelessness solutions.,left
788,The current political landscape is dominated by special interest groups.,left
789,We should focus on policies that promote equality and justice.,left
790,The government needs to protect workers' rights and benefits.,left
791,There is too much partisanship and not enough collaboration.,left
792,We need leaders who prioritize the needs of the people over politics.,left
793,The current system does not represent the interests of the majority.,left
794,Political rhetoric has become too hateful and divisive.,left
795,There should be more regulations to protect the environment.,left
796,The current administration is not listening to scientific experts.,left
797,Healthcare reform should be a top priority in politics.,left
798,The political system is broken and needs comprehensive reform.,left
799,We need to increase funding for mental health services.,left
800,The current political climate is neglecting human rights issues.,left
801,"We should focus on building bridges, not walls.",left
802,There is a lack of leadership on important global issues.,left
803,The current administration is not doing enough to support education.,left
804,We need to address the root causes of poverty and inequality.,left
805,The current political system is rigged in favor of the wealthy.,left
806,More action is needed to combat systemic injustices.,left
807,The government should be held accountable for its actions.,left
808,There needs to be a stronger focus on community support and development.,left
809,The current political climate is harming the country's unity.,left
810,"Common-sense gun control, like background checks, is necessary, but we should also respect the Second Amendment rights of law-abiding citizens.",center
811,A balanced tax policy that ensures everyone pays their fair share is essential for a sustainable economy.,center
812,"Immigration reform should be comprehensive, focusing on securing the borders while also providing a fair path to citizenship for undocumented immigrants.",center
813,Social media companies need to protect free speech while implementing measures to reduce misinformation and hate speech.,center
814,Investing in both green energy and traditional energy sources can ensure energy independence and environmental sustainability.,center
815,Healthcare reform should focus on increasing accessibility and affordability without completely overhauling the current system.,center
816,"Public education needs more funding, but we should also allow for school choice to accommodate diverse educational needs.",center
817,"A diverse media landscape is important for democracy, but media outlets should strive for unbiased reporting and transparency.",center
818,Welfare programs should provide a safety net but also include initiatives that promote work and self-sufficiency.,center
819,"Religious freedom should be protected, but it should not be used to justify discrimination against others.",center
820,"Reducing the national debt is important, but it should not come at the expense of essential social programs.",center
821,Affirmative action policies should focus on socioeconomic factors to provide opportunities for all disadvantaged groups.,center
822,"Police reform is necessary to address misconduct, but we also need to support law enforcement in maintaining public safety.",center
823,Education should promote critical thinking and teach students about diverse perspectives and social issues.,center
824,"The U.S. should be a leader in combating climate change, but policies should also consider economic impact and job creation.",center
825,"Judges should interpret the law based on the Constitution, but they should also consider modern societal values.",center
826,"Social safety nets are important, but we should ensure that they are efficient and not open to abuse.",center
827,"Big tech companies should be regulated to protect consumer privacy, but we should avoid stifling innovation.",center
828,"Voting rights should be protected, but voter ID laws can be implemented in a way that is fair and non-discriminatory.",center
829,"The federal government should have a role in addressing national issues, but states should have flexibility to tailor solutions to their needs.",center
830,Immigration policy should focus on both border security and the humane treatment of immigrants and refugees.,center
831,"Gun control measures like background checks are necessary, but we should also protect the rights of responsible gun owners.",center
832,"Climate change is a significant issue, and we should adopt pragmatic policies that balance environmental protection and economic growth.",center
833,"Cancel culture should not be used to silence people; instead, we should encourage open dialogue and accountability.",center
834,"Family values are important, but policies should respect diverse family structures and promote support for all types of families.",center
835,"Socialism has its flaws, but elements like universal healthcare and social safety nets can be beneficial if implemented wisely.",center
836,"Reforming entitlement programs is necessary to ensure their sustainability, but changes should not harm those who rely on them.",center
837,Criminal justice reform should balance rehabilitation with the need to maintain public safety.,center
838,"A strong military is necessary for national security, but we should also invest in diplomacy and international cooperation.",center
839,"The Electoral College has its merits, but we should explore reforms to ensure it reflects the popular will.",center
840,"Religious liberty should be protected, but it should not allow for discrimination or exclusion.",center
841,"Small businesses are crucial to the economy, and we should support them with fair regulations and tax policies.",center
842,Welfare reform should promote self-reliance while providing support for those who genuinely need it.,center
843,"The First Amendment is vital for free speech, but we should also combat hate speech and misinformation.",center
844,"Education reform should focus on improving outcomes for all students, regardless of background or location.",center
845,"The free market is a powerful tool for economic growth, but government intervention is sometimes necessary to address inequalities.",center
846,Energy policy should include a mix of renewable energy and fossil fuels to ensure reliability and sustainability.,center
847,"Strong borders are important for security, but we should also create a fair and humane immigration system.",center
848,"Capitalism is effective, but it should be balanced with regulations that protect workers and consumers.",center
849,"Government spending should be responsible, with a focus on efficiency and eliminating waste.",center
850,"The Constitution is the bedrock of our democracy, and it should be interpreted in a way that respects its principles while adapting to modern times.",center
851,"Law enforcement should be supported, but there must be accountability for misconduct to build community trust.",center
852,"The right to bear arms is important, but reasonable regulations can help reduce gun violence and enhance public safety.",center
853,"Parental rights in education are important, but schools should also provide a comprehensive curriculum that includes diverse perspectives.",center
854,"America should lead by example in promoting democracy and human rights, both at home and abroad.",center
855,Tax policy should encourage economic growth while ensuring that the wealthy pay their fair share.,center
856,Identity politics can be divisive; we should focus on policies that promote unity and equality for all.,center
857,"The military should be prepared for defense, but we should avoid unnecessary military interventions.",center
858,Secure elections are crucial for democracy; we should implement measures that protect voting rights and election integrity.,center
859,"Parents should have a say in their children's education, but schools should also teach critical thinking and respect for diversity.",center
860,"A strong economy is built on innovation and hard work, and we should support policies that encourage entrepreneurship.",center
861,School curricula should focus on academic excellence and teach students about the importance of civic engagement and social responsibility.,center
862,"International organizations can play a role in global cooperation, but U.S. sovereignty should always be respected.",center
863,"The death penalty should be carefully considered, with a focus on ensuring justice and preventing wrongful convictions.",center
864,"Personal responsibility is important, but we should also recognize the role of systemic issues in shaping opportunities.",center
865,"Foreign aid should be targeted and effective, supporting humanitarian efforts and global stability.",center
866,Healthcare policy should balance public options with private choice to ensure coverage for all.,center
867,"Public universities should encourage free speech and a diversity of ideas, fostering an environment of open debate.",center
868,Mandatory minimum sentences should be re-evaluated to ensure fairness and justice in the criminal justice system.,center
869,National security should include both strong defense capabilities and efforts to address root causes of conflict.,center
870,"Term limits for elected officials could bring fresh perspectives, but experience and stability are also important.",center
871,"The Second Amendment protects individual rights, but common-sense regulations can help keep communities safe.",center
872,"Climate policy should prioritize both environmental protection and economic growth, finding a balance that benefits all.",center
873,"Free markets drive innovation, but regulations are necessary to protect consumers and ensure fair competition.",center
874,"Rural communities deserve attention and investment, just as much as urban centers do.",center
875,A balanced Supreme Court that interprets the law impartially is essential for maintaining the rule of law.,center
876,"America's military strength is important, but we should also emphasize diplomacy and international cooperation.",center
877,Reducing the influence of special interests in politics can improve trust in government and democracy.,center
878,"Civil liberties must be protected, especially in times of crisis, to ensure freedom and justice for all.",center
879,Greater accountability in government agencies can improve efficiency and public trust.,center
880,"Free speech is fundamental, but we must also address the harm caused by hate speech and misinformation.",center
881,Welfare systems should include work incentives to encourage self-sufficiency while providing necessary support.,center
882,Judges should be appointed based on their qualifications and commitment to upholding the Constitution.,center
883,"Education funding should be equitable, ensuring that all students have access to quality education.",center
884,"Reducing government regulation can boost economic growth, but essential protections for health and safety should remain.",center
885,"Religious institutions should be free to practice their beliefs, but they should not impose those beliefs on others.",center
886,"Common-sense gun laws, such as background checks, can coexist with the right to own firearms.",center
887,The role of the federal government should be to address issues that are beyond the capacity of individual states.,center
888,Economic policy should aim to reduce poverty while encouraging economic growth and innovation.,center
889,"Climate change is a critical issue, and we should seek solutions that balance environmental and economic priorities.",center
890,The judiciary should remain independent and free from political influence to ensure fair justice for all.,center
891,"National security policies should be comprehensive, addressing both military threats and cybersecurity.",center
892,"Education should prepare students for the future, emphasizing both STEM subjects and critical thinking skills.",center
893,Public health initiatives are important for preventing disease and promoting overall well-being.,center
894,Government transparency is key to accountability and building public trust.,center
895,Immigration policy should respect human dignity while ensuring the security and integrity of our borders.,center
896,"Healthcare reform should focus on reducing costs and improving quality, making care accessible to everyone.",center
897,"Voter access should be protected, but measures should be in place to ensure the integrity of elections.",center
898,"Balancing the budget is important, but it should not come at the cost of essential services for citizens.",center
899,Criminal justice reform should aim to reduce incarceration rates and promote rehabilitation.,center
900,Environmental policy should protect natural resources while allowing for responsible economic development.,center
901,"The right to free speech is essential, but we should also encourage respectful and constructive dialogue.",center
902,Investing in infrastructure is crucial for economic growth and improving quality of life.,center
903,Government programs should be efficient and focused on delivering results that benefit the public.,center
904,Public safety requires both effective law enforcement and community engagement.,center
905,Education reform should include investment in vocational training and job skills development.,center
906,Tax reform should simplify the tax code while ensuring fairness and reducing loopholes.,center
907,"Support for veterans should include healthcare, education, and job training to help them reintegrate into civilian life.",center
908,"Cybersecurity is a growing threat, and we need strong policies to protect our information infrastructure.",center
909,Trade policies should promote fair competition and protect American jobs while fostering global cooperation.,center
910,"Healthcare policy should provide options that meet the diverse needs of citizens, balancing public and private interests.",center
911,Foreign policy should prioritize diplomacy and peaceful conflict resolution.,center
912,"Economic growth should be inclusive, ensuring that all citizens benefit from prosperity.",center
913,"Renewable energy development is important, but it should be part of a broader energy strategy that includes traditional sources.",center
914,Public education should prepare students to be informed and active citizens in a democratic society.,center
915,We should support criminal justice reforms that focus on rehabilitation and reducing recidivism.,center
916,"Reducing poverty requires a combination of job creation, education, and targeted social programs.",center
917,Political discourse should be respectful and focused on finding common ground.,center
918,Immigration policy should reflect both compassion and the rule of law.,center
919,"Infrastructure investment should address both urban and rural needs, promoting regional development.",center
920,A strong economy is essential for national security and overall prosperity.,center
921,Energy policy should aim for sustainability and energy independence.,center
922,"Health and safety regulations are important for protecting the public, but they should be fair and not overly burdensome.",center
923,The judiciary should protect individual rights while upholding the rule of law.,center
924,We should invest in public health to prevent future pandemics and improve overall health outcomes.,center
925,Education funding should prioritize underfunded schools and ensure equal opportunities for all students.,center
926,Economic policies should promote job creation and ensure that workers receive fair wages.,center
927,Balanced immigration policies can strengthen our economy and uphold our values.,center
928,Social programs should be designed to help individuals become self-sufficient and economically independent.,center
929,The role of government should be to provide opportunities and support while respecting individual freedoms.,center
930,National defense should include both military strength and diplomatic efforts to build global partnerships.,center
931,"Public healthcare options can coexist with private insurance, providing more choices for citizens.",center
932,We should support policies that protect the environment while fostering economic growth.,center
933,Campaign finance reform is necessary to reduce the influence of money in politics.,center
934,Economic policies should focus on reducing inequality and promoting opportunities for all.,center
935,Social justice initiatives should address systemic inequalities and promote fairness.,center
936,"The U.S. should lead in innovation and technology, investing in research and development.",center
937,Balanced energy policies should include renewable energy and traditional sources for stability and sustainability.,center
938,We should encourage civic engagement and educate citizens about their rights and responsibilities.,center
939,Healthcare policy should aim for universal access while maintaining quality and choice.,center
940,Education reforms should include support for teachers and modernizing school infrastructure.,center
941,Public safety strategies should be data-driven and community-focused.,center
942,"Economic growth should benefit all citizens, not just the wealthy.",center
943,Public transportation investment can reduce traffic congestion and improve quality of life.,center
944,Government accountability is crucial for maintaining public trust and transparency.,center
945,We should promote policies that support families and ensure work-life balance.,center
946,Environmental protection is essential for the health and well-being of future generations.,center
947,Affordable housing policies should address the needs of low- and middle-income families.,center
